"id","gene_symbol","gene_id","species_name","pubmed","description","entrez_id","gene_name","function","ensembl","alias"
40,"LCB4","YOR171C","Saccharomyces cerevisiae","18690010","Deletion of LCB4 increases replicative lifespan and cancels out replicative lifespan extension of 0.5% glucose DR [2514]. ",854342,"Long-Chain Base 4","Lcb4p; Sphingoid long-chain base kinase, responsible for synthesis of long-chain base phosphates, which function as signaling molecules, regulates synthesis of ceramide from exogenous long-chain bases, localizes to the Golgi and late endosomes [Source:SGD;Acc:S000005697] [Ensembl]","YOR171C",""
41,"ATG15","YCR068W","Saccharomyces cerevisiae","18690010","Deletion of ATG15 does not affect the lifespan significantly under ad lib, while DR shortens replicative lifespan of ATG15 deletion mutant by 28% [2514].",850432,"AuTophaGy related 15","Atg15p; Lipase required for intravacuolar lysis of autophagic bodies and Cvt bodies; targeted to intravacuolar vesicles during autophagy via the multivesicular body (MVB) pathway [Source:SGD;Acc:S000000664] [Ensembl]","YCR068W","AUT5 CVT17"
43,"TCO89","YPL180W","Saccharomyces cerevisiae","18690010,21641548","TCO89 deletion increases chronological lifespan, increases mitochondrial oxygen consumption, but decreases mitochondrial and cellular ROS in early stationary phase [2618]. Deletion of TCO89 cancels out replicative lifespan extension by moderate DR [2514].",855922,"Tor Complex One","Tco89p; Subunit of TORC1 (Tor1p or Tor2p-Kog1p-Lst8p-Tco89p), a complex that regulates growth in response to nutrient availability; cooperates with Ssd1p in the maintenance of cellular integrity; deletion strains are hypersensitive to rapamycin [Source:SGD;Acc:S000006101] [Ensembl]","YPL180W",""
44,"HSP12","YFL014W","Saccharomyces cerevisiae","22848679","HSP12 deletion abolishes the replicative lifespan extending effect of moderate DR [3447].",850532,"Heat Shock Protein 12","Hsp12p; Plasma membrane protein involved in maintaining membrane organization in stress conditions; induced by heat shock, oxidative stress, osmostress, stationary phase, glucose depletion, oleate and alcohol; regulated by HOG and Ras-Pka pathways [Source:SGD;Acc:S000001880] [Ensembl]","YFL014W","GLP1 HOR5"
45,"NFU1","YKL040C","Saccharomyces cerevisiae","20421943","NFU1 mutation slightly shortens the chronological lifespan under ad libitum and the chronological lifespan of NFU1 mutants is not extended by 0.5% glucose DR [2501].",853826,"NifU-like protein 1","Mitochondrial matrix protein, involved in iron-sulfur complex biogenesis.; Nfu1p; Protein involved in iron metabolism in mitochondria; similar to NifU, which is a protein required for the maturation of the Fe/S clusters of nitrogenase in nitrogen-fixing bacteria [Source:SGD;Acc:S000001523] [Ensembl]","YKL040C","NUB1"
46,"FET3","YMR058W","Saccharomyces cerevisiae","20421943,18679056","FET3 mutation slightly shortens chronological lifespan under ad libitum. Its chronological lifespan is not extended by 0.5% glucose or amino-acid DR [2501]. FET3 is one of several iron related genes that are up-regulated in response to increasing strength of glucose DR [2561].",855080,"FErrous Transport 3","Multicooper oxidase, that along with iron permiase (Ftr1), compromises a high affinity iron uptake system; Fet3p; Ferro-O2-oxidoreductase required for high-affinity iron uptake and involved in mediating resistance to copper ion toxicity, belongs to class of integral membrane multicopper oxidases [Source:SGD;Acc:S000004662] [Ensembl]","YMR058W",""
47,"ATG16","YMR159C","Saccharomyces cerevisiae","20421943","Under ad libitum atg16 mutation shortens chronological, but not replicative lifespan. 0.5% glucose DR extends chronological lifespan of atg16 mutants, but amino-acid DR does not extend the short chronological lifespan of atg16 mutants (similar to several other autophagy mutants). |ADE4| deletion in atg16 mutants results only in a partial extension of chronological lifespan by 0.5% glucose DR. The long chronological lifespan of |tor1| mutants requires ATG16 [2501].",855194,"AuTophaGy related 16","Atg16p; Conserved protein that interacts with Atg12p-Atg5p conjugates to form Atg12p-Atg5p-Atg16p multimers, which localize to the pre-autophagosomal structure and are required for autophagy [Source:SGD;Acc:S000004769] [Ensembl]","YMR159C","APG15 APG16 CVT11 SAP18"
48,"ADE4","YMR300C","Saccharomyces cerevisiae","20421943","ade4 mutation extends chronological lifespan, but not replicative lifespan, and is non-additive with 0.5% glucose or amino-acid DR on chronological lifespan extension. ADE4 deletion in |atg16| mutants results only in a partial extension of the chronological lifespan by 0.5% glucose DR [2501].",855346,"ADEnine requiring 4","Ade4p; Phosphoribosylpyrophosphate amidotransferase (PRPPAT; amidophosphoribosyltransferase), catalyzes first step of the 'de novo' purine nucleotide biosynthetic pathway [Source:SGD;Acc:S000004915] [Ensembl]","YMR300C",""
49,"ATG2","YNL242W","Saccharomyces cerevisiae","20421943","ATG2 deletion prevents chronological lifespan extension induced by amino-acid DR [2501].",855479,"AuTophaGy related 2","Atg2p; Peripheral membrane protein required for vesicle formation during autophagy, pexophagy, and the cytoplasm-to-vaucole targeting (Cvt) pathway; involved in Atg9p cycling between the phagophore assembly site and mitochondria [Source:SGD;Acc:S000005186] [Ensembl]","YNL242W","APG2 AUT8 SPO72"
50,"VPS30","YPL120W","Saccharomyces cerevisiae","20421943","VPS30 deletion prevents chronological lifespan extension induced by amino-acid DR [2501].",855983,"Vacuolar Protein Sorting 30","Vps30p; Subunit of phosphatidylinositol (PtdIns) 3-kinase complexes I and II; Complex I is essential in autophagy and Complex II is required for vacuolar protein sorting; ortholog of the higher eukaryotic gene Beclin 1 [Source:SGD;Acc:S000006041] [Ensembl]","YPL120W","APG6 ATG6 VPT30"
51,"GIT3","SPCC1753.02c","Schizosaccharomyces pombe","19266076","GIT3 encodes a G protein-coupled receptor for glucose. Git3 deletion increases chronological lifespan in conditions where glucose consumption is not affected. Constitutive activation of Galpha subunit acting downstream of Git3 accelerates aging and inhibits effect of DR [2562].",2538770,"G-protein coupled receptor Git3",NULL,NULL,""
52,"gpa2","SPAC23H3.13c","Schizosaccharomyces pombe","19266076","Gpa2 (alias git8) encodes the alpha subunit of a heterotrimeric G protein, which acts downstream of |GIT3|. Git8 activity accelerates aging and inhibits the lifespan-extending effect of DR. Constitutive active mutation of gpa2 decreases chronological lifespan under ad libitum (2% glucose) and almost completely cancels out the lifespan extending effect of DR (0.2% glucose) [2562].",2541720,"Guanine nucleotide-binding protein alpha-2 subunit","family with sequence similarity 49, member A [Source:HGNC Symbol;Acc:25373] [Ensembl]",NULL,"git8"
53,"sty1","SPAC24B11.06c","Schizosaccharomyces pombe","20075862","Deleting sty1 cancels out chronological lifespan extension and enhanced heat stress resistance by DR. Sty1 (phosphorylated) and Sty1-dependent gene transcription is activated during DR in the stationary phase, but are barely activated in glucose rich medium [2563].",2541652,"MAP kinase Sty1","","","phh1 spc1"
54,"pka1","SPBC106.10","Schizosaccharomyces pombe","16822282,20075862","pka1 knockouts exhibits a three-fold increase in chronological lifespan with up to 187% longer maximum lifespan [2342]. While deleting pka1 extends chronological lifespan under normal condition, there is no additive effect with DR [2563].",2539781,"cAMP-dependent protein kinase 1","cAMP-dependent protein kinase catalytic subunit Pka1",NULL,"git6 tpk"
55,"atf1","SPBC29B5.01","Schizosaccharomyces pombe","20075862","Activation of transcription factor Atf1 by |Sty1| is required for chronological lifespan extension and enhanced heat stress resistance by DR. Deleting atf1 cancels out DR-mediated chronological lifespan extension and enhanced heat stress resistance. Overexpressing atf1 is not sufficient to promote chronological lifespan extension in cells lacking sty1 [2563].",2540329,"activating transcription factor 1","transcription factor, Atf-CREB family Atf1; protein disulfide isomerase family A, member 6 [Source:HGNC Symbol;Acc:30168] [Ensembl]",NULL,"gad7 mts1 sss1"
56,"wis1","SPBC409.07c","Schizosaccharomyces pombe","20075862","Constitutive active mutation of wis1 extends chronological lifespan and there is no further beneficial effect of DR [2563].",2541055,"MAP kinase kinase Wis1","","","smf2 spc2"
57,"daf-16","R13H8.1","Caenorhabditis elegans","8247153,17538612,16720740,17900900,18331616,19079239,19239417,19924292","daf-16 is required for lifespan extension by mutation of |daf-2| or |age-1| [239]. In one experiment, daf-16 mutation suppressed lifespan extension by DR [2494]. Another study found that DR does not stimulate DAF-16 translocation to the nucleus, but daf-16 mutation cancels out the ability of DR to extend lifespan and to delay the decline in locomotor activity [2564]. In another study, DR by bacterial dilution extended lifespan of daf-16 mutants [2360]. daf-16 mutation decreases lifespan under ad lib, but fails to prevent bacterial dilution DR to further extend lifespan [2565]. Intermittent fasting-induced lifespan-extension is significantly diminished in null mutants of daf-16, suggesting daf-16 partially mediates intermittent fasting-induced longevity [2566]. daf-16 mutation cancels out the lifespan extension effect of solid DR and peptone dilution, regardless of the concentration of bacteria or peptones. Bacterial dilution DR significantly extends lifespan of daf-16 mutants, but to a lesser extent than that of wild-type. |eat-2| mutation extends the lifespan of daf-16 mutants to the same extent than that of wild-type [2568]. Another study found that daf-16 RNAi completely blocks the lifespan extension by |daf-2| mutation, but only partially by bacterial dilution DR [2569].",172981,"Abnormal DAuer Formation DAF-16, fork head-related transcription factor (daf-16)","Forkhead family transcription factor; Forkhead-type transcription factor. Binds to the promoters of genes that contain the daf-16 binding element (DBE), TTGTTTAC, in their regulatory region. Functions in the Insulin/IGF-1-like signaling (IIS) mediated pathway which affects lipogenesis, lifespan, starvation survival, heat shock response, and dauer formation. Daf-16 transcriptional activity is negatively regulated by cytoplasmic sequestration. Inhibition is required for the carbon dioxide (CO2) avoidance response. Upon loss of inhibition, daf-16 translocates to the nucleus to regulate genes that result in delayed reproduction and growth while increasing stress resistance starvation tolerance and longevity. Has a protective role against muscle dystrophy. Involved in mediating protection against aberrant protein aggregation proteotoxicity. Influences transcription of genes that code for proteins involved in immunity as part of a general stress response. Targets genes that inhibit and stimulate tumor growth. Thought to regulate ins-7 in FOXO-to-FOXO signaling, which coordinates daf-16 expression. Functions by indirect interaction with jnk-1 of the mitogen- activated protein kinase (MAPK) pathway. [UniProt]","R13H8.1",""
58,"daf-2","Y55D5A.5","Caenorhabditis elegans","9789046,17538612,17900900,19079239,19924292,18043747","daf-2 mutants live more than twice as long as controls. Its relation to DR is unclear. daf-2 mutation extends lifespan of wild-type and |eat-2| mutants [1820]. Long lifespan of daf-2 insulin receptor mutation is further extended by solid DR [2564]. DR by bacterial dilution extends lifespan of daf-2 mutants [2360]. Intermittent fasting does not markedly extend lifespan of daf-2 mutants [2566]. Bacterial dilution DR increases lifespan by 65%. daf-2 mutation further increases lifespan under bacterial dilution DR by 40% [2569]. DR from |eat-2| mutation has an additive effect on lifespan of daf-2(e1370) adults, but not on lifespan of daf-2(e1368) adults [2600]. ",175410,"abnormal DAuer Formation 2","An insulin receptor-like protein which regulates metabolism, controls longevity and prevents developmental arrest at the dauer stage. Binding of INS family members may either stimulate, or antagonise, association of the receptor with downstream mediators such as pdk-1 and age-1. Required for the response to environmental stimuli such as food, pheromone, and temperature. Role in immune function and pathogen resistance. [UniProt]","Y55D5A.5",""
59,"clk-1","ZC395.2","Caenorhabditis elegans","9789046,19079239,19239417,8638122","Mutations in clk-1 slow down development and extend lifespan by 30% [946]. Food restriction by |eat-2| mutation does not further extend the long lifespan of clk-1 mutant [1820]. DR and clk-1 mutations may extend lifespan by a similar process. DR by intermittent fasting significantly extends lifespan of clk-1 mutants, but to a lesser extent than that of wild-type [2566]. clk-1 mutants do not respond to solid DR-induced lifespan extension [2568]. clk-1 mutants have a decreased pharyngeal pumping that may provoke voluntary DR [1820]. ",175729,"CLocK (biological timing) abnormality 1","Plays a role in biological timing and in longevity. [UniProt]","ZC395.2",""
60,"sams-1","C49F5.1","Caenorhabditis elegans","16103914","sams-1 RNAi significantly extends lifespan of wild-type by 14 - 15%, of |daf-16| mutant by 30% and |daf-2| by 55%, but fails to significantly further extend lifespan of |eat-2| mutants. mRNA level of sams-1 is 2-fold reduced in |eat-2| mutants. Like DR, sams-1 RNAi reduces brood size and slightly reproductive timing as well as causes a slender phenotype [2240]. ",181370,"S-Adenosyl Methionine Synthetase 1","Catalyzes the formation of S-adenosylmethionine from methionine and ATP (By similarity). [UniProt]","C49F5.1",""
61,"rab-10","T23H2.5","Caenorhabditis elegans","16103914","rab-10 RNA interference significantly extends lifespan of wild-type by 14 - 16%, of |daf-16| mutants by 47%, and of |daf-2| by 46%, but fails to significantly further extend lifespan of |eat-2| mutants, a genetic model of DR. rab-10 RNAi does not affect pumping, but similar to DR reduces and delays reproduction as well as cause a slender appearance. rab-10 mRNA is 2-fold downregulated in response to DR [2240].",266836,"RAB family","Protein RAB-10; RAB family member (rab-10)  [Source:RefSeq peptide;Acc:NP_491857] [Ensembl];  rab-10 encodes a Rab-like GTPase that is a member of the Ras superfamily of small GTPases; RAB-10 is required, upstream of RME-1, for basolateral endocytic recycling in the intestine, but not in oocytes or coelomocytes; RAB-10 is also required for GLR-1 receptor recycling in interneurons; a RAB-10::GFP fusion protein is widely expressed and in the intestine, localizes to early endosomes and the Golgi.  [WormBase]","T23H2.5",""
62,"drr-1","F45H10.4","Caenorhabditis elegans","16103914","drr-1 RNAi significantly extends mean lifespan of wild-type by 37 - 44%, but does not extend significantly the lifespan of |eat-2| mutants. drr-1 RNAi does not affect pumping, but similar to DR reduces and delays reproduction as well as causes a slender appearance. drr-1 mRNA is 2-fold downregulated in response to DR [2240].",174994,"Dietary Restriction Response (WT but not eat-2 lifespan increased) 1","Protein DRR-1; Dietary Restriction Response (WT but not eat-2 lifespan increased) family member (drr-1)  [Source:RefSeq peptide;Acc:NP_496840] [Ensembl]","F45H10.4",""
63,"drr-2","T12D8.2","Caenorhabditis elegans","15998808,16103914,20456299","RNA interference of drr-2 extends lifespan [2236]. drr-2 RNAi extends lifespan of wild-type by 10-16%, but fails to significantly extend lifespan of |daf-2| mutants or |eat-2| mutants, a genetic model of DR. drr-2 RNAi keeps a normal, well-fed appearance and normal reproduction. drr-2 mRNA expression is 2-fold reduced in |eat-2| mutants [2240]. drr-2 overexpression suppresses lifespan extension by |eat-2| mutation and solid plate-based DR [2637].",259546,"Dietary Restriction Response (WT but not eat-2 lifespan increased) 2","Protein DRR-2; Dietary Restriction Response (WT but not eat-2 lifespan increased) family member (drr-2)  [Source:RefSeq peptide;Acc:NP_499818] [Ensembl]","T12D8.2",""
64,"sir-2.1","R11A8.4","Caenorhabditis elegans","11242085,16860373,19239417,17081160","sir-2.1 deletion slightly reduces lifespan of wild-type [2296]. sir-2.1 overexpression extends lifespan by about 50% and this lifespan extension depends on |DAF-16| activity and it does not synergize with |daf-2| [199]. sir-2.1 suppresses longevity of |eat-2| mutants, but not |daf-2| mutants. sir-2.1 is therefore partially required for lifespan extension from mutation of |eat-2| [2296], but is completely independent for lifespan extension from DR using a reduced feeding protocol [3446]. Solid DR increases lifespan of wild-type and sir-2.1 mutants to the same extent [2568].",177924,"Yeast SIR related 1","NAD(+)-dependent histone deacetylase that silences gene expression; NAD-dependent deacetylase (By similarity). Functions upstream of daf-16 in the insulin-like signaling pathway, promoting daf-16 mediated transcriptional activation and increased life-span. May also regulate life-span independently of daf-16 by modulating the transcription of genes involved in the stress response of the endoplasmic reticulum (ER). [UniProt]","R11A8.4",""
65,"let-363","B0261.2","Caenorhabditis elegans","17266679,16720740,19079239","let-363 RNAi significantly extends the lifespan of wild-type, but does not further extend the long lifespan of |eat-2| mutant [2312]. let-363 RNAi led to an average increase in lifespan of 8% in wild-type and 3% in |eat-2| background, suggesting let-363 works synergistically with |eat-2| mutation [2494]. Another study showed that DR fails to significantly extend lifespan of let-363 RNAi-treated animals [2566].",172167,"LEThal 363","Regulation of cell growth and differentiation in response to nutrients; Kinase that regulates the mRNA translation machinery, probably by modulating the activity of translation factors such as eIF-4G and eIF-2. It may have some protein kinase activity instead of lipid kinase activity. May act as a mediator of lifespan regulation by insulin signaling and nutrient sensing. [UniProt]","B0261.2",""
66,"age-1","B0334.8","Caenorhabditis elegans","8700226,8608934,18828672,16720740","Recessive knockout mutants of age-1 have a 40-65% increase in mean lifespan and a 65-110% increase in maximum lifespan [2237] [1518]. age-1(mg44) zygotic null mutants have a mean (99%) and maximum (117%) lifespan extension [2441]. age-1 mutation significantly extends lifespan under ad lib, but only slightly under solid DR [2494].  ",174762,"AGEing alteration 1","Phosphatidylinositol 3-kinase homolog that regulates longevity and diapause. Could function in the development or neuroendocrine signaling of the dauer pathway. [UniProt]","B0334.8",""
67,"pha-4","F38A6.1","Caenorhabditis elegans","17476212,19079239,19239417","pha-4 is required for multiple forms of DR. RNAi of pha-4 decreases lifespan of wild-type worms and completely cancels out the lifespan extension of |eat-2| mutants. Mutants of pha-4 do not respond to bacterial DR. Therefore, loss of pha-4 completely blocks the response to varying food concentration. Moreover, pha-4 expression is increased in response to DR. pha-4 overexpression increases longevity of wild-type only slightly, but significant that of |daf-16| mutants [2340]. Intermittent fasting significantly extends lifespan of pha-4 [2566]. Solid DR extends lifespan of mutants with a temperature sensitive allele of pha-4 or pha-4 RNAi knockdown [2568]. PHA-4 appears to play a role in the life-extending effects of dietary restriction. ",180357,"defective PHArynx development 4","Acts as a transcription factor required for formation of the pharyngeal primordium. Binds to the consensus sequence 5'- T[AG]TT[TG][AG][TC]-3' with variations of the sequence affecting onset of target gene expression. Activates a wide array of pharyngeal genes including ceh-22 and myo-2 and represses ectodermal genes lin-26 and elt-3, ensuring pharyngeal cell fate. Required for recruitment of htz-1 to a subset of pharyngeal promoters to ensure gene activation and also acts synergistically with tbx-2 in pharyngeal development. Acts in the regulation of diet-restriction-mediated longevity by increasing expression of sod-1, sod-2, sod-4 and sod-5 but not sod-3. [UniProt]","F38A6.1",""
68,"smk-1","F41E6.4","Caenorhabditis elegans","17476212","smk-1 RNAi only slightly shortens the lifespan of wild-type worms, but abolishes the extended lifespan of |eat-2| mutants. Loss of smk-1 by temperature sensitive allele suppresses the extended lifespan under optimal bacterial dilution DR, but not the response to DR itself [2340].",179243,"SMEK (Dictyostelium Suppressor of MEK null) homolog 1","Protein SMK-1; SMEK (Dictyostelium Suppressor of MEK null) homolog family member (smk-1)  [Source:RefSeq peptide;Acc:NP_001023909] [Ensembl];  smk-1 encodes a novel, evolutionarily conserved protein that is orthologous to the mammalian and Dictyostelium discoideum SMEK (suppressor of MEK null) proteins; smk-1 activity is essential for several aspects of DAF-16-mediated longevity namely, the defense response to pathogenic bacteria and increased resistance to oxidative and UV-induced damage; in regulating DAF-16 activity, SMK-1 appears to act by affecting the transcription of DAF-16 target genes, such as sod-3, ctl-1, and lys-8; SMK-1 is present in the nucleus of intestinal cells, many head and tail neurons, and some hypodermal cells throughout development.  [WormBase]","F41E6.4",""
69,"skn-1","T19E7.2","Caenorhabditis elegans","17538612,18358814,19079239,19239417","RNA interference or mutations in skn-1 prevent the life-extension effects of dietary restriction [2360]. skn-1 transgenes that overexpress a constitutive nuclear form of SKN-1 in the intestine extend the mean lifespan by 5-21% [2497]. skn-1 mutation does not alter lifespan under ad lib, but cancels out the lifespan extension effect of liquid DR or food variation at all. Ectopic expression of skn-1b in ASI neurons rescued liquid DR longevity defects of skn-1. Therefore, skn-1 might be regulated by nutritional stress [2360]. Intermittent fasting significantly extends lifespan of skn-1 mutants [2566]. Solid DR extends lifespan of a skn-1 loss-of-function mutant and wild-type to a similar extent [2568].",177343,"SKiNhead 1","bZIP transcription factor, critical in endodermal development and control of the oxidative stress; Required to specify the fate of ventral blastomeres in the early embryo, and postembryonically for the development of the intestine. Directly regulates expression of zygotically expressed med-1 and med-2 to direct mesendoderm development. [UniProt]","T19E7.2",""
70,"aak-2","T01C8.1","Caenorhabditis elegans","17900900,15574588","AAK-2 could be a sensor that couples energy levels and insulin-like signals to lifespan. aak-2(ok524) knockout mutants have a 12% and 18% shorter mean and maximum lifespan, respectively as well as faster age-dependent accumulation of a lipofuscin-like fluorescent pigment in the intestine [2232]. Solid DR increases AMP:ATP ratio. aak-2 mutation suppresses lifespan extension and delay of the decline in locomotor activity resulting from solid DR. A constitutive active mutation of aak-2 is sufficient to cause increase stress resistance as well as to significantly extend lifespan. Both increased stress resistance and extended lifespan is reverted in |daf-16| knockdown by RNAi [2564]. aak-2 mutation cancels out the lifespan extension effect of solid DR and peptone dilution, regardless of the concentration of bacteria or peptones. Bacterial dilution DR significantly extends lifespan of aak-2 mutants, but to a lesser extent than that of wild-type. |eat-2| mutation extends the lifespan of aak-2 mutants to the same extent than that of wild-type.",181727,"AMP-Activated Kinase 2","Acts as a sensor that couples lifespan to information about energy levels and insulin-like signals. Role in motility and response to oxidative stress. Causes germ cell cycle arrest upon dauer entry. [UniProt]","T01C8.1",""
