"id","gene_symbol","gene_id","species_name","pubmed","description","entrez_id","gene_name","function","ensembl","alias"
1,"SIR2","YDL042C","Saccharomyces cerevisiae","10521401,16286010,11000115,12213553,15328540","Deletion of SIR2 shortens replicative lifespan by approximately 30%. Integration of a second copy of SIR2 into the wild-type strain leads to an extension of replicative lifespan by around 35% in the W303R strain [200]. 0.5% glucose restriction fails to increase the short lifespan of sir2Delta [2260]. 0.1% glucose restriction extends replicative lifespan of sir2 mutants [2552]. 0.5, 0.1 and 0.05% glucose restriction are able to increase lifespan of sir2;fob1 double mutant to a greater extent than in wild-type. 0.05% glucose restriction further extends replicative lifespan of SIR2 overexpression mutant [2554]. Sir2 blocks extreme chronological lifespan extension as the lack of Sir2 along with DR and/or mutations in the yeast AKT homolog, |Sch9|, or Ras pathways causes a dramatic chronological lifespan extension (6-fold) [1564]. ",851520,"Silent Information Regulator 2","Sir2 is a NAD(+)-dependent protein deacetylase which promotes transcriptional silincing at HM loci, telomeres and rDNA and represses recombination between rDNA repeats.; Sir2p; Conserved NAD+ dependent histone deacetylase of the Sirtuin family involved in regulation of lifespan; plays roles in silencing at HML, HMR, telomeres, and the rDNA locus; negatively regulates initiation of DNA replication [Source:SGD;Acc:S000002200] [Ensembl]","YDL042C","MAR1"
2,"CDC25","YLR310C","Saccharomyces cerevisiae","11000115","The CDC25-10 allele extends mean and maximum replicative lifespan by 34% and 18%, respectively, at 30 degree Celsius. cdc25-10 mutants have an extended replicative lifespan under ad libitum. Growth on 0.5% glucose restriction does not further extend replicative lifespan of cdc25-10 mutants. CDC25 null mutant is not viable. CDC25 appears to act in the same genetic pathway as |SIR2| and |NPT1| and is suggested to be a genetic model of DR [2260].",851019,"Cell Division Cycle 25","Cdc25p; Membrane bound guanine nucleotide exchange factor (GEF or GDP-release factor); indirectly regulates adenylate cyclase through activation of Ras1p and Ras2p by stimulating the exchange of GDP for GTP; required for progression through G1 [Source:SGD;Acc:S000004301] [Ensembl]","YLR310C","CTN1"
3,"HAP4","YKL109W","Saccharomyces cerevisiae","12124627,20178842","Overexpression of HAP4 increases replicative lifespan, but is non-additive with 0.5% glucose restriction in lifespan extension. Lifespan extension by HAP4 overexpression requires |SIR2| [2274]. HAP4 deletion suppresses replicative lifespan extension to 30% and 33% on 0.1% glucose and on elimination of non-essential amino acids, respectively [2638]. ",853751,"Heme Activator Protein 4","Hap4p; Subunit of the heme-activated, glucose-repressed Hap2p/3p/4p/5p CCAAT-binding complex, a transcriptional activator and global regulator of respiratory gene expression; provides the principal activation function of the complex [Source:SGD;Acc:S000001592] [Ensembl]","YKL109W",""
4,"PNC1","YGL037C","Saccharomyces cerevisiae","14724176,12736687","Cells with 5 copies of PNC1 have a 70% longer replicative lifespan which is cancelled out by |SIR2| deletion. PNC1 is upregulated under glucose DR [2499]. Deletion of PNC1 shortens replicative lifespan approximately by 10% [2499] and largely prevents replicative lifespan extension of 0.5% glucose restriction. 0.5% glucose restriction slightly extends median replicative lifespan (by 10 - 15%) but not maximum replicative lifespan in pnc1Delta [2329]. Increased expression of PNC1 is both necessary and sufficient for replicative lifespan extension by DR and low-intensity stress. DR does not further increase the lifespan of the 5XPNC1 strain [2499]. ",852846,"Pyrazinamidase/NiCotinamidase 1","Pnc1p; Nicotinamidase that converts nicotinamide to nicotinic acid as part of the NAD(+) salvage pathway, required for life span extension by calorie restriction; PNC1 expression responds to all known stimuli that extend replicative life span [Source:SGD;Acc:S000003005] [Ensembl]","YGL037C",""
5,"CYT1","YOR065W","Saccharomyces cerevisiae","12124627,14724176,16311627","Deletion of CYT1 decreases RLS and cancels RLS extension of HAP4 overexpression [2274]. Initially, it was shown that deletion of CYT1 also prevents life span extension by glucose DR [2329]. But later it was shown that both 0.5 or 0.05 % glucose DR increases life span of cytDelta cells [2553].",854231,"Cyt1p",NULL,"YOR065W","CTC1 YOR29-16"
6,"SCH9","YHR205W","Saccharomyces cerevisiae","16293764,12586694,11292860,18340043,18225956","Transposon-mediated mutagenesis of SCH9 increases resistance to oxidants and thermal stress as well as extends chronological lifespan by 30%. SCH9 deletion increases chronological lifespan by up to threefold. [2346]. Deletion of SCH9 also increases replicative lifespan by 18% (in DBY746) [2271]. SCH9 deletion increases the replicative lifespan by 40% in the alpha strain [2504]. The extended lifespan of SCH9 deletion mutants is not further extended by low glucose DR and is independent of |Sir2| [1570]. Water restriction further increases chronological lifespan of sch9Delta [2556]. ",856612,"serine/threonine protein kinase SCH9","","","HRM2 KOM1"
196,"Mdh2","","Drosophila melanogaster","26378219
","Wild type flies and flies containing mutant Mdh2 (56% activity compared to the wild type) were subjected to dietary restriction. Both wild type and mutant flies showed a significant increase in lifespan under dietary restriction compared to normal conditions. However, flies with mutant Mdh2 had a significantly longer lifespan than the wild type, demonstrating that decreased Mdh2 activity enhances the effects of dietary restriction. ",42185,"Malate dehydrogenase 2","","","CG 7998 CG7998 Dmel\CG7998 l(3)psg7 Mdh MDH-2 mdh2 mMdh psg7"
7,"NPT1","YOR209C","Saccharomyces cerevisiae","11000115,17110466,17482543,11884393","Increased dosage of NPT1 increases |SIR2|-dependent silencing and extends replicative lifespan by up to 60%. 0.5% glucose restriction does not significantly further increase replicative lifespan of NPT1 overexpression [2335]. NPT1 deletion decreases replicative lifespan by 50% [2550] as well as chronological lifespan [2510]. Deletion of NPT1 shortens the lifespan in W303R. Replicative lifespan extension of cdc25-10 mutation (assumed to act as a genetic DR-mimetic) is cancelled out by NPT1 deletion [2260].",854384,"Nicotinate PhosphoribosylTransferase 1","Npt1p; Nicotinate phosphoribosyltransferase, acts in the salvage pathway of NAD+ biosynthesis; required for silencing at rDNA and telomeres and has a role in silencing at mating-type loci; localized to the nucleus [Source:SGD;Acc:S000005735] [Ensembl]","YOR209C",""
9,"RPD3","YNL330C","Saccharomyces cerevisiae","10512855,12213553","Deletion of the histone deacetylase gene RPD3 extends lifespan by 41%, independently of an intact Sir silencing complex (in the short-lived YSK661 strain) [203]. Deletion of RPD3 extends replicative lifespan and there was no additive effect by neither 0.1% glucose nor amino acid restriction [2552].     ",855386,"Reduced Potassium Dependency 3","Rpd3p; Histone deacetylase; regulates transcription, silencing, and other processes by influencing chromatin remodeling; forms at least two different complexes which have distinct functions and members [Source:SGD;Acc:S000005274] [Ensembl]","YNL330C","MOF6 REC3 SDI2 SDS6"
10,"HST2","YPL015C","Saccharomyces cerevisiae","16051752,17129213","HST2 overexpression extends replicative lifespan. 0.5% glucose restriction does not increase lifespan of sir2;fob1;hst2 triple mutants [2309]. DR increases lifespan of all four sir2;fob1;hstX(X = sirtuin) triple mutants [2558].",856092,"Homolog of SIR Two (SIR2) 2","Hst2p; Cytoplasmic member of the silencing information regulator 2 (Sir2) family of NAD(+)-dependent protein deacetylases; modulates nucleolar (rDNA) and telomeric silencing; possesses NAD(+)-dependent histone deacetylase activity in vitro [Source:SGD;Acc:S000005936] [Ensembl]","YPL015C",""
11,"TOR1","YJR066W","Saccharomyces cerevisiae","16293764,16418483,18225956,21076178","TOR1 deletion extends mean and maximum replicative lifespan by 21 and 25% [1570] as well as chronological lifespan [2591]. This lifespan extension is independent of |SIR2| [1570]. Deletion of TOR1 extends replicative lifespan as well as chronological lifespan [2591] and glucose restriction fails to further extend the long replicative lifespan of tor1Delta [1570] [2238] [2556]. Water starvation (extreme DR) further extends chronological lifespan of tor1 mutants [2556].",853529,"Target Of Rapamycin 1","Tor1p; PIK-related protein kinase and rapamycin target; subunit of TORC1, a complex that controls growth in response to nutrients by regulating translation, transcription, ribosome biogenesis, nutrient transport and autophagy; involved in meiosis [Source:SGD;Acc:S000003827] [Ensembl]","YJR066W","DRR1"
12,"LAT1","YNL071W","Saccharomyces cerevisiae","17200108","LAT1 is suggested to play a role in lifespan extension of DR. Deleting LAT1 abolishes replicative lifespan extension induced by 0.5% and 0.05% glucose restriction. In contrast, overexpressing Lat1 extends replicative lifespan, and this lifespan extension was not further increased by 0.5% glucose restriction. Similar to DR, replicative lifespan extension by LAT1 overexpression largely requires mitochondrial respiration [2317]. Interestingly, LAT1 overexpression does not require the Sir2 family to extend lifespan. Lat1 is also a limiting longevity factor in non-dividing cells in that overexpressing LAT1 extends cell survival during prolonged culture at stationary phase. ",855653,"dihydrolipoyllysine-residue acetyltransferase","","","ODP2 PDA2"
195,"Gdh","","Drosophila melanogaster","26378219
","Wild type flies and flies containing mutant Gdh (71% activity compared to the wild type) were subjected to dietary restriction. Both wild type and mutant flies showed a significant increase in lifespan under dietary restriction compared to normal conditions. However, flies with mutant Gdh had a significantly longer lifespan (more than 14 days) than the wild type, demonstrating that decreased Gdh activity enhances the effects of dietary restriction. ",42832,"Glutamate dehydrogenase","","","CG5320 DHE3 Dmel\CG5320 gdh GDH GLU-D Glud GLUD GLUD pre-mRNA"
14,"MSN2","YMR037C","Saccharomyces cerevisiae","11000115,18225956,14741356","Deletion of MSN2 and |MSN4| extends replicative lifespan [2559]. Deletion of MSN2 and |MSN4| does not significantly decrease chronological lifespan under ad libitum, but attenuates chronological lifespan extension by water starvation and 0.5% glucose restriction [2556]. msn2 msn4 has no effect on replicative lifespan in PSY316, and does not prevent lifespan extension by DR [2260].",855053,"Multicopy suppressor of SNF1 mutation 2","Msn2p; Transcriptional activator related to Msn4p; activated in stress conditions, which results in translocation from the cytoplasm to the nucleus; binds DNA at stress response elements of responsive genes, inducing gene expression [Source:SGD;Acc:S000004640] [Ensembl]","YMR037C",""
15,"MSN4","YKL062W","Saccharomyces cerevisiae","11000115,18225956,14741356","Deletion of |MSN2| and MSN4 extends replicative lifespan [2559]. Deletion of |MSN2| and MSN4 does not significantly decrease chronological lifespan under ad libitum, but attenuates chronological lifespan extension by water starvation and 0.5% glucose restriction [2556]. msn2 msn4 has no effect on replicative lifespan in PSY316, and does not prevent lifespan extension by DR [2260].",853803,"Multicopy suppressor of SNF1 mutation 4","Msn4p; Transcriptional activator related to Msn2p; activated in stress conditions, which results in translocation from the cytoplasm to the nucleus; binds DNA at stress response elements of responsive genes, inducing gene expression [Source:SGD;Acc:S000001545] [Ensembl]","YKL062W",""
16,"NDE1","YMR145C","Saccharomyces cerevisiae","14724176,16436509","Overexpression of NDE1 and |NDE2| increases intracellular NAD/NADH ratio by lowering NADH concentration and increases replicative lifespan by 20-25%. This lifespan extension is non-additive with 0.5% glucose restriction [2329]. Deletion of NDE1 extends chronological lifespan [2330].",855176,"NADH Dehydrogenase, External 1","Nde1p; Mitochondrial external NADH dehydrogenase, a type II NAD(P)H:quinone oxidoreductase that catalyzes the oxidation of cytosolic NADH; Nde1p and Nde2p provide cytosolic NADH to the mitochondrial respiratory chain [Source:SGD;Acc:S000004753] [Ensembl]","YMR145C","NDH1"
17,"NDE2","YDL085W","Saccharomyces cerevisiae","14724176","Overexpression of |NDE1| and NDE2 increases intracellular NAD/NADH ratio by lowering NADH concentration and increases replicative lifespan by 20-25%. This lifespan extension is non-additive with 0.5% glucose restriction [2329].",851474,"NADH Dehydrogenase, External 2","Nde2p; Mitochondrial external NADH dehydrogenase, catalyzes the oxidation of cytosolic NADH; Nde1p and Nde2p are involved in providing the cytosolic NADH to the mitochondrial respiratory chain [Source:SGD;Acc:S000002243] [Ensembl]","YDL085W","NDH2"
18,"MDH1","","Saccharomyces cerevisiae","18381895","Overexpression of MDH1 extends replicative lifespan by 25% and does not synergize with 0.5% glucose restriction [2511].",853777,"Malate DeHydrogenase 1","Mdh1p; Mitochondrial malate dehydrogenase, catalyzes interconversion of malate and oxaloacetate; involved in the tricarboxylic acid (TCA) cycle; phosphorylated [Source:SGD;Acc:S000001568] [Ensembl]","YKL085W",""
19,"AAT1","YKL106W","Saccharomyces cerevisiae","18381895","Overexpression of AAT1 extends replicative lifespan by 25% and does not synergize with 0.5% glucose restriction [2511].",853755,"Aspartate AminoTransferase 1","Aat1p; Mitochondrial aspartate aminotransferase, catalyzes the conversion of oxaloacetate to aspartate in aspartate and asparagine biosynthesis [Source:SGD;Acc:S000001589] [Ensembl]","YKL106W",""
20,"GUT2","YIL155C","Saccharomyces cerevisiae","18381895","Overexpression of GUT2 extends replicative lifespan by 25% and does not synergize with 0.5% glucose restriction [2511].",854651,"Glycerol UTilization 2","Gut2p; Mitochondrial glycerol-3-phosphate dehydrogenase; expression is repressed by both glucose and cAMP and derepressed by non-fermentable carbon sources in a Snf1p, Rsf1p, Hap2/3/4/5 complex dependent manner [Source:SGD;Acc:S000001417] [Ensembl]","YIL155C",""
21,"HXK2","YGL253W","Saccharomyces cerevisiae","11000115,12124627","Deletion of HXK2 extends mean and maximum replicative lifespan by about 53% and 33%, respectively. Limiting glucose availability by mutating HXK2 significantly extends replicative lifespan and provides a genetic model of DR [2260]. HXK2 mutants have a transcriptional profile that significantly resembles DR cells [2274].",852639,"HeXoKinase 2","Hxk2p; Hexokinase isoenzyme 2 that catalyzes phosphorylation of glucose in the cytosol; predominant hexokinase during growth on glucose; functions in the nucleus to repress expression of HXK1 and GLK1 and to induce expression of its own gene [Source:SGD;Acc:S000003222] [Ensembl]","YGL253W","HEX1 HKB SCI2"
22,"GPA2","YER020W","Saccharomyces cerevisiae","11000115","Deletion of GPA2 increases mean and maximum replicative lifespan by 40% and 26%, respectively. Deletion of GPA2 extends replicative lifespan by reducing cAMP-PKA activity and provides a genetic model for DR [2260].",856741,"G Protein Alpha subunit 2","Gpa2p; Nucleotide binding alpha subunit of the heterotrimeric G protein that interacts with the receptor Gpr1p, has signaling role in response to nutrients; green fluorescent protein (GFP)-fusion protein localizes to the cell periphery [Source:SGD;Acc:S000000822] [Ensembl]","YER020W","SSP101"
23,"GPR1","YDL035C","Saccharomyces cerevisiae","11000115","Deletion of GRP1 increases mean and maximum replicative lifespan by 41% and 26%, respectively. GRP1 deletion mutants have also longer chronological lifespan. Deletion of GPR1 extends replicative lifespan by reducing cAMP-PKA activity and provides a genetic model for DR [2260].",851527,"G-Protein coupled Receptor 1","Gpr1p; Plasma membrane G protein coupled receptor (GPCR) that interacts with the heterotrimeric G protein alpha subunit, Gpa2p, and with Plc1p; sensor that integrates nutritional signals with the modulation of cell fate via PKA and cAMP synthesis [Source:SGD;Acc:S000002193] [Ensembl]","YDL035C",""
24,"CYR1","YJL005W","Saccharomyces cerevisiae","11000115","The CDC35-1 allele of the adenylate cyclase CYR1 confers a 75% extension of replicative. The CYR1 mutation is assumed to act as genetic DR mimetic [2260].",853452,"CYclic AMP Requirement 1","Cyr1p; Adenylate cyclase, required for cAMP production and cAMP-dependent protein kinase signaling; the cAMP pathway controls a variety of cellular processes, including metabolism, cell cycle, stress response, stationary phase, and sporulation [Source:SGD;Acc:S000003542] [Ensembl]","YJL005W","CDC35 FIL1 HSR1 SRA4 TSM0185"
25,"GIS1","YDR096W","Saccharomyces cerevisiae","19030232,18225956","Deletion of GIS1 increases replicative lifespan by 25% in the alpha strain [2503]and causes a major, although not complete, reversion of chronological lifespan extension by 0.5% glucose restriction [2556].",851670,"GIg1-2 Suppressor 1","Gis1p; JmjC domain-containing histone demethylase and transcription factor; involved in expression of genes during nutrient limitation; negatively regulates DPP1 and PHR1; activity is modulated by limited proteasome-mediated proteolysis; has a JmjC and a J /.../main in the N-terminal region that interact, promoting Gis1p stability and proper transcriptional activity; contains transactivating domains TAD1 and TAD2 downstream of the Jmj domains and a C-terminal DNA binding domain [Source:SGD;Acc:S000002503] [Ensembl]; JmjC domain-containing histone demethylase and transcription factor; involved in expression of genes during nutrient limitation; negatively regulates DPP1 and PHR1; activity is modulated by limited proteasome-mediated proteolysis; has a JmjC and a JmjN domain in the N-terminal region that interact, promoting Gis1p stability and proper transcriptional activity; contains transactivating domains TAD1 and TAD2 downstream of the Jmj domains and a C-terminal DNA binding domain [SGD]","YDR096W",""
26,"RIM15","YFL033C","Saccharomyces cerevisiae","11292860,18225956,21076178","RIM15 deletion results in 50% reduction of maximal chronological lifespan [2346] and consistently decreases chronological lifespan under ad libitum [2591]. Rim15 is required for chronological lifespan extension caused by deficiency in |TOR1| or |SCH9|, as well as by 0.5% glucose restriction, but not by water starvation [2556].",850511,"Regulator of IME2 15","Rim15p; Glucose-repressible protein kinase involved in signal transduction during cell proliferation in response to nutrients, specifically the establishment of stationary phase; identified as a regulator of IME2; substrate of Pho80p-Pho85p kinase [Source:SGD;Acc:S000001861] [Ensembl]","YFL033C","TAK1"
27,"HST1","YOL068C","Saccharomyces cerevisiae","16051752,17129213","Deletion of HST1 blocks the residual replicative lifespan extension by hxk2 mutant in a sir2;fob1;hst2 triple mutant background [2309]. However, DR can increases the replicative lifespan to a similar extent in sir2;fob1;hst1;hst2 quadruple mutant cells as in sir2;fob1 double mutant cells under 0.5, 0.05 and 0.005% glucose conditions and even by hxk2 deletion mutant [2558].",854086,"Homolog of SIR Two (SIR2) 1","Hst1p; NAD(+)-dependent histone deacetylase; essential subunit of the Sum1p/Rfm1p/Hst1p complex required for ORC-dependent silencing and mitotic repression; non-essential subunit of the Set3C deacetylase complex; involved in telomere maintenance [Source:SGD;Acc:S000005429] [Ensembl]","YOL068C",""
31,"PCK1","YKR097W","Saccharomyces cerevisiae","19303850","Knockout of PCK1 dramatically reduces chronological lifespan in both water (extreme DR) and glucose-containing medium. pck-1-K514Q mutation which abrogates enzymatic activity of Pck1, just like |SIR2| deletion, extends chronological lifespan in water. Deletion of |SIR2| does not alter the lifespan of PCK1 deletion mutant, pck1-K514R, and pck1-K514Q mutants [2526].",853972,"Phosphoenolpyruvate CarboxyKinase 1","Pck1p; Phosphoenolpyruvate carboxykinase, key enzyme in gluconeogenesis, catalyzes early reaction in carbohydrate biosynthesis, glucose represses transcription and accelerates mRNA degradation, regulated by Mcm1p and Cat8p, located in the cytosol [Source:SGD;Acc:S000001805] [Ensembl]","YKR097W","JPM2 PPC1"
32,"RPL31A","YDL075W","Saccharomyces cerevisiae","16293764,18423200","Deletion of RPL31A increases mean replicative lifespan by 45% [1570]. Deletion of RPL31A extends replicative lifespan and is not further extended by 0.05% glucose restriction [2505].",851484,"Ribosomal Protein of the Large subunit 31A","Rpl31ap; Protein component of the large (60S) ribosomal subunit, nearly identical to Rpl31Bp and has similarity to rat L31 ribosomal protein; associates with the karyopherin Sxm1p; loss of both Rpl31p and Rpl39p confers lethality [Source:SGD;Acc:S000002233] [Ensembl]","YDL075W","RPL34"
33,"GSH1","YJL101C","Saccharomyces cerevisiae","18840459","Deletion of GSH1 confers deficiency in glutathione biosynthesis and further increases chronological lifespan under 0.5% glucose restriction, but does not extend chronological lifespan under 2% glucose. Therefore, GSH1 has a positive interaction with DR [2560].",853344,"glutathione (GSH) 1","Gsh1p; Gamma glutamylcysteine synthetase catalyzes the first step in glutathione (GSH) biosynthesis; expression induced by oxidants, cadmium, and mercury [Source:SGD;Acc:S000003637] [Ensembl]","YJL101C",""
34,"YPT7","YML001W","Saccharomyces cerevisiae","18340043,18690010","YPT7 deletion decreases replicative lifespan by 15% in the alpha strain [2504]. Deletion of YPT7 cancels out replicative lifespan extension of 0.5% glucose restriction and results under DR also into a shorter replicative lifespan than under ad libitum [2514].",855012,"Yeast Protein Two 7","Ypt7p; Rab family GTPase; GTP-binding protein of the rab family; required for homotypic fusion event in vacuole inheritance, for endosome-endosome fusion, similar to mammalian Rab7 [Source:SGD;Acc:S000004460] [Ensembl]","YML001W","AST4 VAM4"
35,"NYV1","YLR093C","Saccharomyces cerevisiae","18690010","Deletion of NYV1 cancels out replicative lifespan extension of 0.5% glucose restriction and results under DR also into a shorter replicative lifespan than under ad libitum. Thus, NYV1 deletion blocks DR-lifespan prolongation [2514].",850782,"New Yeast V-SNARE 1","Nyv1p; v-SNARE component of the vacuolar SNARE complex involved in vesicle fusion; inhibits ATP-dependent Ca(2+) transport activity of Pmc1p in the vacuolar membrane [Source:SGD;Acc:S000004083] [Ensembl]","YLR093C","MAM2"
36,"ERG5","YMR015C","Saccharomyces cerevisiae","18340043,18690010,21447998","Deletion of ERG5 decreases replicative lifespan by 35% in the a strain [2504], but increases mean chronological lifespan by 26 - 116% (26, 40, 43, 62, 116) in diploid cells [2593]. Deletion of ERG5 cancels out the replicative lifespan extension of 0.5% glucose restriction [2514].",855029,"ERGosterol biosynthesis 5","Erg5p; C-22 sterol desaturase, a cytochrome P450 enzyme that catalyzes the formation of the C-22(23) double bond in the sterol side chain in ergosterol biosynthesis; may be a target of azole antifungal drugs [Source:SGD;Acc:S000004617] [Ensembl]","YMR015C","CYP61"
37,"ERG6","YML008C","Saccharomyces cerevisiae","18690010","Deletion of ERG6 cancels out replicative lifespan extension of 0.5% glucose DR and results under DR also into a shorter replicative lifespan than under ad libitum [2514].  ",855003,"ERGosterol biosynthesis 6","Erg6p; Delta(24)-sterol C-methyltransferase, converts zymosterol to fecosterol in the ergosterol biosynthetic pathway by methylating position C-24; localized to both lipid particles and mitochondrial outer membrane [Source:SGD;Acc:S000004467] [Ensembl]","YML008C","ISE1 LIS1 SED6 VID1"
38,"ERG3","YLR056W","Saccharomyces cerevisiae","18690010","Deletion of ERG3 decreases replicative lifespan under ad libitum, cancels out replicative lifespan extension of 0.5% glucose DR and results under DR also into a shorter replicative lifespan than under ad lib [2514].",850745,"ERGosterol biosynthesis","Erg3p; C-5 sterol desaturase, catalyzes the introduction of a C-5(6) double bond into episterol, a precursor in ergosterol biosynthesis; mutants are viable, but cannot grow on non-fermentable carbon sources [Source:SGD;Acc:S000004046] [Ensembl]; C-5 sterol desaturase, glycoprotein that catalyzes the introduction of a C-5(6) double bond into episterol, a precursor in ergosterol biosynthesis; mutants are viable, but cannot grow on non-fermentable carbon sources; substrate of the HRD ubiquitin ligase [SGD]","YLR056W","PSO6 SYR1"
39,"SUR4","YLR372W","Saccharomyces cerevisiae","18690010","Deletion of SUR4 cancels out replicative lifespan extension of 0.5% glucose DR [2514].",851087,"SUppressor of Rvs161 and rvs167 mutations 4","Sur4p; Elongase, involved in fatty acid and sphingolipid biosynthesis; synthesizes very long chain 20-26-carbon fatty acids from C18-CoA primers; involved in regulation of sphingolipid biosynthesis [Source:SGD;Acc:S000004364] [Ensembl]","YLR372W","APA1 ELO3 SRE1 VBM1"
