"id","gene_symbol","gene_id","species_name","pubmed","description","entrez_id","gene_name","function","ensembl","alias"
71,"bec-1","T19E7.3","Caenorhabditis elegans","17912023,12958363,18282106","bec-1 is required for normal dauer morphogenesis and lifespan extension. Knockdown of bec-1 via RNA interference results in a shortened mean and maximum lifespan by 14 and 5% [2250]. bec-1 RNAi does not significantly change the lifespan of wild-type, but completely suppresses the longevity phenotype of |eat-2| mutation [2244] [2570].",177345,"BEClin (human autophagy) homolog 1","Protein BEC-1; BEClin (human autophagy) homolog family member (bec-1)  [Source:RefSeq peptide;Acc:NP_500844] [Ensembl];  bec-1 encodes a coiled-coil protein orthologous to the yeast and mammalian autophagy proteins Atg6/Vps30/Beclin1; by homology, BEC-1 may be part of a Class III phosphatidylinositol 3-kinase complex that plays a role in localizing autophagy proteins to preautophagosomal structures and overexpression of C. elegans bec-1 in S. cerevisiae APG6/VPS30 mutants can rescue associated autophagy defects; bec-1 is also required for regulation of endocytic retrograde transport; in C. elegans, bec-1 activity is required for normal dauer morphogenesis and survival of dauer larvae, as well as for adult life span extension of daf-2(e1370) mutants at 15 degrees; in addition, bec-1(RNAi) indicates a role for bec-1 in normal growth rates, movement, and vulval morphogenesis; a bec-1::GFP reporter fusion is expressed in the hypodermis, intestine, nervous system, pharynx, and reproductive organs, all tissues that are remodeled during dauer larval development; in vivo genetic evidence in C. elegans indicates that autophagy genes like bec-1, atg-7 and atg-18 protect cells from the accumulation of aggregates of polyglutamine expansion proteins which have been implicated in Huntington's disease and other neurodegenerative disorders.  [WormBase]","T19E7.3",""
72,"atg-7","M7.5","Caenorhabditis elegans","17912023","RNA interference against atg-7 shortens mean lifespan by 23% and maximum lifespan by 30% in a |eat-2| mutant background but not in wild-type animals. Thus, atg-7 RNAi does not affect lifespan of wild-type, but cancels out the lifespan extension effect of |eat-2| mutation, a genetic model of DR [2244].",178005,"AuTophaGy (yeast Atg homolog) 7","Protein ATG-7; AuTophaGy (yeast Atg homolog) family member (atg-7)  [Source:RefSeq peptide;Acc:NP_502064] [Ensembl];  atg-7 encodes an E1 ubiquitin-activating-like enzyme orthologous to the  autophagic budding yeast protein Apg7p; ATG-7 is required for normal     dauer morphogenesis and autophagy in daf-2 mutant animals; ATG-7, along with other autophagic proteins such as BEC-1 and ATG-18, protects cells from polyglutamine aggregates like those found in Huntington's disease and other neurodegenerative disorders.  [WormBase]","M7.5",""
73,"vps-34","B0025.1","Caenorhabditis elegans","18282106","vps-34 RNAi does not significantly change lifespan of wild-type, but cancels out the lifespan extension effect of |eat-2| mutation [2570].",172280,"related to yeast Vacuolar Protein Sorting factor 34","Protein VPS-34; related to yeast Vacuolar Protein Sorting factor family member (vps-34)  [Source:RefSeq peptide;Acc:NP_491741] [Ensembl];  vps-34 encodes an ortholog of the phosphoinositide 3-kinase VPS34 in S. cerevisiae, a protein that regulates multiple steps in endocytosis, and that is required for growth at normal rates during development; in C. elegans, vps-34 is required for vesicular trafficking, including endocytosis, apoptotic cell clearance, and autophagy.   Inactivation of vps-34 by RNAi induces a defect in encocytotic uptake of secreted GFP into coelomocytes from pseudocoelomic fluid. In addition, vps-34(RNAi) mutants exhibit slower growth than normal. vps-34 is ubiquitously expressed in all tissues and developmental stages. VPS-34 protein accumulates in a perinuclear region of the cell. vps-34(h510) mutants display an expansion of the outer nuclear membrane, and VPS-34 is genetically required for the secretion and localization of the LDL receptor LRP-1 at the apical surface of the hypodermal syncytium. Phosphatidylinositol 3-phosphate (PtdIns 3-P) produced by VPS-34 associates with several intracellular membranes and periphereal vesicles, including endocytic vesicles. These data are consistent with the hypothesis that VPS-34 is generally required for membrane transport from the outer nuclear membrane towards the cell periphery.  [WormBase]","B0025.1",""
74,"hsf-1","Y53C10A.12","Caenorhabditis elegans","12750521,14668486,18331616,19239417,19924292,22737090","RNA interference of hsf-1 suppresses normal dauer formation and life-extension due to insulin-like signalling [985]. hsf-1 overexpression extends mean, median, and maximum lifespan by 37, 35, and 29% [2588]. hsf-1 RNAi abrogates lifespan extension by |daf-2|(e1370) mutation, but not |eat-2|(ad1116). HSF-1, like |DAF-16|, is required for |daf-2| mutations to extend lifespan [626]. A mutant allele of hsf-1 slightly decreases lifespan under ad lib, but cancels out the lifespan extension effect of bacterial dilution DR [2565]. Solid DR extends the lifespan of hsf-1 mutant with a premature stop codon, that eliminates activation domain, and that of wild-type to a similar extent [2568]. In another experiment, hsf-1 RNAi attenuated lifespan extension by bacterial dilution DR, but only partially that of |daf-2| mutation. hsf-1 RNAi attenuated protection against oxidative stress by bacterial dilution DR. hsf-1 expression was induced by bacterial dilution DR [2569]. ",173078,"Heat Shock Factor 1","Protein HSF-1; Heat Shock Factor family member (hsf-1)  [Source:RefSeq peptide;Acc:NP_493031] [Ensembl]","Y53C10A.12",""
75,"rheb-1","F54C8.5","Caenorhabditis elegans","19079239","rheb-1 RNAi extends lifespan by mimicking the DR effect. Under ad lib conditions, rheb-1 RNAi extends lifespan by 19.1% and the longevity-promoting effects of two DR regimens solid DR and intermittent fasting are abolished [2566].",176327,"RHEB (Ras Homolog Enriched in Brain) hom","binds GTP and exhibits intrinsic GTPase activity (By similarity). [UniProt]","F54C8.5",""
76,"hsp-12.6","F38E11.2","Caenorhabditis elegans","19079239","hsp-12.6 loss-of-function mutation significantly extends lifespan under ad lib and significantly suppresses intermittent fasting-induced increase in lifespan, to a similar extend to that of |daf-16| mutation. HSP-12.6 expression is induced by fasting in various tissues, including body wall muscle and neuronal systems. hsp-16.2 is one of downstream targets of DAF-16 in intermittent fasting-induced longevity. The extent of intermittent fasting-induced longevity in |daf-16| hsp-12.6 double mutant is similar to that of single hsp-12.6 or |daf-16| mutants [2566].",177778,"Heat Shock Protein","Protein HSP-12.6; Heat Shock Protein family member (hsp-12.6)  [Source:RefSeq peptide;Acc:NP_501668] [Ensembl];  hsp-12.6 encodes a small heat-shock protein with very short N- and C-terminal domains flanking its central region of similarity to alpha-crystallins; HSP-12.6 is required in vivo for normal lifespan; HSP-12.6 is predominantly and ubiquitously expressed in L1 larvae without any obvious induction by stressors; but, in adult hermaphrodites, at least one HSP-12 is also expressed in spermatids (and perhaps spermatocytes), as well as in some vulval cells; moreover, hsp-12.6 is upregulated in 6- and 10-day-old daf-2 mutants, and this upregulation is highly reproducible (like that of five other genes, vit-2, vit-5, fat-3, nid-1, and mtl-1), strongly suggesting that hsp-12.6's expression may contribute to prolonged lifespan in dauer larvae; the hsp-12.6 promoter is predicted to have both DAF-16 and HSF-1 binding sites; hsp-12.6(RNAi) animals are shorter-lived than normal; recombinant HSP-12.6 is monomeric, and lacks molecular chaperone activity in vitro; hsp-12.6 induction requires DAF-16 and HSP-1, but not SMK-1.  [WormBase]","F38E11.2",""
77,"hif-1","F38A6.3","Caenorhabditis elegans","19372390,19461873","One study found that hif-1 mutation does not suppress lifespan extension of bacterial dilution DR or |eat-2| mutation [2434]. hif-1 deletion extends lifespan by 24% and inhibition of hif-1 by RNAi also extends adult lifespan. hif-1 mutation extends lifespan under ad lib, but does not further extend lifespan extension under modified solid DR [2571].",180359,"HIF (hypoxia inducible factor) homolog 1","including environment stress resistance (oxygen levels, hydrogen sulfide levels and heat), negative regulation of cell apoptosis in ASJ neurons by inhibition of cep-1 via transcriptional activation of tyr-2, resistance/susceptibility to pathogenic bacteria, lifespan and brood size. Involved in mediating susceptibility to enteropathogenic E.coli. Increased levels of hif-1 activity confer resistance to P.aeruginosa- mediated death. Required for aha-1 nuclear localization. Following hypoxic stress, up-regulates serotonin levels through activation of tph-1 expression. Role in life span extension is independent of temperature. Not required for survival in anoxic conditions. [UniProt]","F38A6.3",""
78,"ire-1","C41C4.4","Caenorhabditis elegans","19461873","ire-1 mutation reduces slightly the lifespan under ad lib, but reduces significantly the lifespan extension by DR. ire-1 mutant has a significantly reduced slope in mean lifespan versus food concentrations relative to wild-type [2571].",174305,"IRE1 kinase related 1","Senses unfolded proteins in the lumen of the endoplasmic reticulum via its N-terminal domain which leads to enzyme auto- activation. The active endoribonuclease domain splices xbp-1 precursor mRNA to produce the mature form which then induces transcription of UPR target genes. Unfolded protein response (UPR) transcripional activation by ire-1, as well as translational attenuation by pek-1 in a complementary pathway, maintains ER homeostasis. Ire-1 and pek-1 are redundant genes that control a pathway essential for larval development and survival. [UniProt]","C41C4.4",""
79,"egl-9","F22E12.4","Caenorhabditis elegans","19461873","egl-9 deletion does not affect lifespan under ad lib. Lifespan extension under modified solid DR regimen is diminished by egl-9 mutation. egl-9 mutation significantly suppresses the lifespan extension by a strong loss-of-function allele of |eat-2| [2571].",179461,"EGg Laying defective 9","Protein EGL-9; EGg Laying defective family member (egl-9)  [Source:RefSeq peptide;Acc:NP_001023832] [Ensembl];  egl-9 encodes a dioxygenase that negatively regulates hypoxia inducible factor (hif-1) by hydroxylating prolyl residues in HIF-1.   It belongs to a superfamily of proteins such as AlkB and leprecan that are implicated in oxidative detoxification of alkylated bases and hydroxylation of proteins. egl-9 is expressed in hypodermis, neurons and muscle cells; it is required for muscle function in egg-laying and for lethal paralysis by Pseudomonas aeroginosa PAO1.  [WormBase]","F22E12.4",""
80,"wwp-1","Y65B4BR.4","Caenorhabditis elegans","18006689,19553937","RNA interference of wwp-1 decreases median lifespan by 9% in wild-type animals and 24% in |daf-2| mutants [2239]. Loss of wwp-1 function by RNAi or mutation reduces lifespan at 25 degree Celsius, but not 20 degree Celsius. wwp-1 overexpression extends lifespan by up to 20%. Reduced levels of wwp-1 completely suppress the extended longevity of |eat-2| mutants. Lifespan of wwp-1 mutants across entire food concentration range by bacterial dilution in liquid culture or on solid plates does not noticeable change. There is no difference in wwp-1 mRNA levels under ad lib and DR [2572].",171647,"WW domain Protein (E3 ubiquitin ligase) 1","Protein WWP-1; WW domain Protein (E3 ubiquitin ligase) family member (wwp-1)  [Source:RefSeq peptide;Acc:NP_740775] [Ensembl]","Y65B4BR.4",""
81,"ubc-18","R01H2.6","Caenorhabditis elegans","19553937","ubc-18 overexpression is unable to extend lifespan. Loss of ubc-18 function by mutation or RNAi reduces lifespan at 25 degree Celsius, but only slightly at 20 degree Celsius. RNAi depletion of ubc-18 completely suppresses increased longevity of |eat-2| mutants [2572].",175985,"UBiquitin Conjugating enzyme 18","Protein UBC-18; UBiquitin Conjugating enzyme family member (ubc-18)  [Source:RefSeq peptide;Acc:NP_498541] [Ensembl];  ubc-18 encodes an E2 ubiquitin-conjugating enzyme related to human UBCH7 (OMIM:603731); UBC-18 activity is required for normal growth and reproduction, and UBC-18 functions redundantly with LIN-35/Rb and other class B synthetic multivulval (SynMuv) gene products to regulate pharyngeal morphogenesis during embryonic development; ubc-18 transcripts are detected in the germline, embryos, late larval stages, and adults, suggesting that UBC-18 may function maternally to regulate several aspects of C. elegans development; the substrates of UBC-18 are not yet known.  [WormBase]","R01H2.6",""
84,"nlp-7","F18E9.2","Caenorhabditis elegans","19783783","nlp-7 RNAi or overexpression reduces oxidative stress resistance and shortens lifespan of wild-type under ad lib. nlp-7 RNAi significantly reduces extended lifespan of |eat-2| mutants, but failed to block lifespan extension of |age-1| or |clk-1| mutants. Lifespan of nlp-7 mutants increases only moderately by solid DR [2574].",184647,"Neuropeptide-Like Protein","Protein NLP-7; Neuropeptide-Like Protein family member (nlp-7)  [Source:RefSeq peptide;Acc:NP_509456] [Ensembl]","F18E9.2",""
85,"cup-4","C02C2.3","Caenorhabditis elegans","19783783","cup-4 RNAi or overexpression reduces oxidative stress resistance and shortens lifespan of wild-type under ad lib. cup-4 RNAi significantly reduces the extended lifespan of |eat-2| mutants. Lifespan of cup-4 mutants increases only moderately by solid DR [2574].",176104,"Coelomocyte UPtake defective 4","Thought to regulate endocytosis in coelomocytes through modulation of phospholipase C activity. Possible acetylcholine receptor. [UniProt]","C02C2.3",""
86,"lgc-26","Y58G8A.1","Caenorhabditis elegans","19783783","lgc-26 RNAi significantly decreases lifespan of |eat-2| mutants specifically, whereas lifespan of |age-1| mutants are not affected [2574].",178554,"Ligand-Gated ion Channel 26","Protein LGC-26; Ligand-Gated ion Channel family member (lgc-26)  [Source:RefSeq peptide;Acc:NP_503167] [Ensembl]","Y58G8A.1",""
87,"cup-5","R13A5.1","Caenorhabditis elegans","19783783","cup-5 RNAi significantly decreases lifespan of |eat-2| mutants [2574].",176074,"Coelomocyte UPtake defective 5","Protein CUP-5; Coelomocyte UPtake defective family member (cup-5)  [Source:RefSeq peptide;Acc:NP_498664] [Ensembl];  The cup-5 gene encodes an ortholog of the human mucolipin 1 gene; cup-5 is required for viability, endo-lysosomal transport and the normal degradation of lysosomes; cup-5 mutants also show increased cell death, which might be a secondary consequence of lysosomal dysfunction; the inactivation of mrp-4 which is a ABCC transporter rescues most of the defects in cup-5 mutants, suggesting that the accumulation of ABC transporters in the absence of cup-5, may contribute to the lysosomal defects; cup-5 localizes to lysosomes.  [WormBase]","R13A5.1",""
88,"ckr-1","T23B3.4","Caenorhabditis elegans","19783783","ckr-1 RNAi significantly reduces lifespan of |eat-2| but not that of |age-1| nor |clk-1| mutants [2574].",188774,"CholecystoKinin Receptor homolog 1","Protein CKR-1; CholecystoKinin Receptor homolog family member (ckr-1)  [Source:RefSeq peptide;Acc:NP_491918] [Ensembl];  T23B3.4 encodes a seven transmembrane receptor that is most closely related to the mammalian cholecystokinin receptors; loss of T23B3.4 activity via RNAi, either singly or in combination with another cholecystokinin receptor-encoding gene, Y39A3B.5, has no effect on fat metabolism, however large-scale RNAi screens have reported that T23B3.4(RNAi) results in embryonic lethality and reduced brood sizes; a T23B3.4::GFP reporter is expressed in a subset of nerve ring neurons.  [WormBase]","T23B3.4",""
89,"ckr-2","Y39A3B.5","Caenorhabditis elegans","19783783","ckr-2 RNAi significantly reduces the lifespan of |eat-2| but not that of |age-1| nor |clk-1| mutants [2574].",175341,"CholecystoKinin Receptor homolog 2","Protein CKR-2; CholecystoKinin Receptor homolog family member (ckr-2)  [Source:RefSeq peptide;Acc:NP_001022843] [Ensembl]","Y39A3B.5",""
90,"cbp-1","R10E11.1","Caenorhabditis elegans","19924292","Bacterial dilution DR induces cbp-1 expression. Overexpression of cbp-1 does not significantly affect lifespan. cbp-1 RNAi specifically in adults completely blocks lifespan extension by three distinct protocols of DR, partly by |daf-2| mutation but not of cold and blocks the delay of other age-related pathologies by bacterial dilution DR [2569].",176380,"CBP/p300 homolog 1","Protein CBP-1; Protein cbp-1  [Source:UniProtKB/Swiss-Prot;Acc:P34545] [Ensembl];  cbp-1 encodes a homolog of the mammalian transcriptional cofactors CBP (OMIM:600140) and p300 (E1A-BINDING PROTEIN, 300-KD; OMIM:602700) that have been shown to possess histone acetyltransferase activity, and which, when mutated, lead to Rubinstein-Taybi syndrome (OMIM:180849) and colorectal cancer (OMIM:114500); at least one splicing form of CBP-1 exhibits histone acetyltransferase (HAT) activity in vitro and has a glutamine/asparagine-rich domain; CBP-1 is required during embryogenesis for differentiation of all non-neuronal somatic cell types; CBP-1 is expressed very early in embryogenesis, suggesting that it may interact with maternally provided transcription factors, such as SKN-1, to specific developmental fates.   Two protein products of this gene are predicted to contain a glutamine/asparagine (Q/N)-rich ('prion') domain, by the algorithm of Michelitsch and Weissman (as of the WS77 release of WormBase, i.e., in wormpep77). Proteins bearing such domains can sometimes stably exist in at least two distinct physical states, each associated with a different phenotype; propagation of one of these traits is achieved by a self-perpetuating change in the protein from one form to the other, mediated by conformational changes in the glutamine/asparagine-rich domain. Prion domains are both modular and transferable to other proteins, on which they can confer a heritable epigenetic alteration of function; existing bioinformatics data indicate that they are rare in non-eukarya, but common in eukarya. Therefore, it is possible that this gene's protein product undergoes epigenetic control of protein activity, through heritable epigenetic modulation of protein function by self-perpetuating conformational conversions of normal proteins in healthy cells. It is important to note that this is distinct from, though mechanistically analogous to, disease states associated with prion propagation and amyloidogenesis.  [WormBase]","R10E11.1",""
91,"dve-1","ZK1193.5","Caenorhabditis elegans","19924292","dve-1 RNAi attenuates lifespan extension by bacterial dilution DR, but only partially that of |daf-2| mutation. dve-1 RNAi attenuates protection against oxidative stress by bacterial dilution DR. dve-1 expression is not induced by DR [2569].  ",180398,"DVE (Defective proVEntriculus in Drosophila) homolog) 1","Protein DVE-1; DVE (Defective proVEntriculus in Drosophila) homolog family member (dve-1)  [Source:RefSeq peptide;Acc:NP_001024986] [Ensembl]","ZK1193.5",""
92,"eat-2","Y48B6A.4","Caenorhabditis elegans","9789046,19239417","eat-2 mutants have reduced neuronal signalling due to the loss of the eat-2 nicotinic acetylcholine receptor resulting in decreased pharyngeal pumping that induces a DR-like state by restricting feeding. They are considered a genetic model of DR and live significant longer by up to 57 % [1820]. Solid DR further increases the long lifespan of eat-2 mutants [2568].",175072,"EATing: abnormal pharyngeal pumping",NULL,"Y48B6A.4",""
96,"Rpd3","FBgn0015805","Drosophila melanogaster","12459580","Males heterozygous for hypomorphic or null mutation of Rpd3 have a lifespan extension of 33% and 41 - 47%, respectively. Females heterozygous for a hypomorphic allele have a 52% increase in lifespan, but females carrying a null mutation have only modest increase in maximum lifespan (but not median lifespan). Longevity increases to the same extent in wild-type under low-calorie diet and rpd3 mutants fed normal diet. DR fails to further increase lifespan of rpd3 mutants. DR leads to a moderate but significant down-regulation of Rpd3, analogous to decrease obtained in heterozygotes carrying rpd3 mutation. rpd3 mutants fed normal food and wild-type fed low-calorie increase |Sir2| expression two-fold [202].",38565,"Histone deacetylase Rpd3","Regulates transcription and silencing; Catalyzes the deacetylation of lysine residues on the N- terminal part of the core histones (H2A, H2B, H3 and H4). Histone deacetylation may constitute a tag for epigenetic repression and plays an important role in transcriptional regulation, cell cycle progression and developmental events. For instance, deacetylation of histone H3 may be a prerequisite for the subsequent recruitment of the histone methyltransferase Su(var)3-9 to histones. Involved in position-effect variegation (PEV). [UniProt]","FBgn0015805","CG7471 dHDAC-1 dHDAC1 DHDAC1 Dmel\CG7471 dmHDA401 DmHDAC1 drpd3 dRpd3 dRPD3 DRpd3 E(var)3-64BC HDAC HDAC-1 hdac1 Hdac1 HDAC1 l(3)04556 l(3)64Cc rpd3 RPD3 Rpd3/HDAC rpd[3] Su(var)3-26 Su(var)326 Su(var)328"
97,"Or83b","FBgn0037324","Drosophila melanogaster","17272684","Loss-of-function mutation in Or83b results in olfactory defects, altered adult metabolism, enhanced stress resistance, and life-extension. Fully fed female homozygous Or83b null mutants exhibit a 56% increase in median lifespan and a 30% increase in maximum lifespan. Males are also significantly longer-lived, though to a smaller degree and maximum lifespan is not extended. Heterozygous mutants of both sexes show an intermediate longevity. Lifespan of homozygous Or83b null mutants is further increased by DR, but the relative increase in median and mean longevity is significantly greater when mutants were maintained in well-fed conditions [2337].",40650,"Odorant receptor 83b","Expression of Orco alone leads to formation of rapid and transient ion channels not directly responding to odorants, but directly activated by intracellular cAMP or cGMP. Complexes with conventional odorant receptors (ORs) to form odorant-sensing units, providing sensitive and prolonged odorant signaling and calcium permeability. They are necessary and sufficient to promote functional reconstitution of odor-evoked signaling in sensory neurons that normally respond only to carbon dioxide. Orco is a universal and integral part of the functional odorant receptor, involved in the dendritic localization of other olfactory receptors. Snmp, Or67d and lush act in concert to capture fatty- acid-derived male pheromone 11-cis vaccenyl acetate (cVA) molecules on the surface of Or67d expressing olfactory dendrites and facilitate their transfer to the odorant-receptor Orco complex. [UniProt]","FBgn0037324","83A.2 83b A45 CG10609 Dmel\CG10609 DOR45 DOR83b OR49 or83b Or83b OR83b OR83B vainsA"
98,"chico","FBgn0024248","Drosophila melanogaster","11292874,11951037","Mutation in chico extends mean, median, and maximum lifespan by 56%, 48%, and 42% in homozygotes and 44%, 36%, and 35% in heterozygotes. chico mutation produces dwarf, long-lived females at normal nutrition. Male heterozygous live 13% longer than wild-type, but male homozygous have a shortened lifespan [188]. Wild-type and chico mutant females have similar peak lifespan under DR, but the food concentration at which these are achieved is shifted to higher amounts. chico mutation induces a state equivalent to submaximal, DR-induced slowing of aging [2576]. ",64880,"Insulin receptor substrate-1","Insulin receptor substrate; Activates phosphatidylinositol 3-kinase when bound to the regulatory p85 subunit (By similarity). May mediate the control of various cellular processes by insulin-like peptides. When phosphorylated by the insulin receptor binds specifically to various cellular proteins containing SH2 domains. Involved in control of cell proliferation, cell size, and body and organ growth throughout development. Also has a role in a signaling pathway controlling the physiological response required to endure periods of low nutrient conditions. Insulin/insulin-like growth factor (IGF) signaling pathway has a role in regulating aging and is necessary in the ovary for vitellogenic maturation. [UniProt]","FBgn0024248","anon-WO0078940.1 anon-WO0078940.4 BcDNA.GH11263 BcDNA:GH11263 CG5686 chic Chico CHICO dIRS Dmel\CG5686 fs(2)4 fs(2)ry4 IRS IRS/chico"
100,"gig","CG6975","Drosophila melanogaster","15186745","Overexpression of gig (alias dTsc2) increased mean lifespan by 20% at 25 degree and protected mutants from deleterious effects of rich food, as if mimicking the effect of DR. Lifespan extension was dependent on concentration of yeast extract in the diet with no or slight life extension observed at low concentrations [1317].
Additionally, overexpression of gig (Tsc2) in mated females flies, which results in the inactivation of TOR signaling, affects lifespan extension by methionine restriction. While at 1.0x diet (normal level of all amino-acids, 15% dietary yeast) methionine reduction (from 1mM to 0.2mM) shortened lifespan both for Tsc2 overexpressing and control flies, at a 0.4x diet (0.4x reduced levels of all amino acids, corresponding to 6% dietary yeast) methionine reduction resulted in a decreased lifespan but only for the Tsc2 overexpressing flies, suggesting in this case that methionine reduction and overexpressing Tsc2 share some common mechanisms [3474]. ",40201,"gigas","","FBgn0005198","6975 C1 CG6975 Dmel\CG6975 dTsc2 dTSC2 gig|Tsc2 l(3)109 ME 109 tsc2 Tsc2 TSC2 Tsc2/gig"
